{
  "index": 9,
  "type": "content",
  "title": "パターンカタログが品質の底上げを実現",
  "message": "SWOT・フロー・比較表などの定型パターンが蓄積され、提案書の品質が継続的に向上する",
  "pattern": "text_and_image",
  "tone": "solution",
  "body_points": [
    "11種の構造パターン: 箇条書き、3カード、フロー、マトリクス等",
    "6種のフレームワーク: SWOT、空雨傘、As-Is/To-Be、PDCA等",
    "作成するたびにパターンが増え、次回以降の品質が自動的に向上",
    "共通スキルとテンプレート固有スキルの2層で知識を管理"
  ],
  "image_hint": "パターンが積み重なるカタログ、整理された引き出しのイメージ"
}
