{
  "index": 11,
  "type": "content",
  "title": "定量効果と将来ロードマップ",
  "message": "時間93%削減・品質統一・再利用80%の効果を実現し、自律進化するシステムへ発展する",
  "pattern": "kpi_cards",
  "tone": "solution",
  "body_points": [
    "作成時間を8時間から30分に短縮（93%削減）",
    "テンプレート準拠でデザイン品質を完全統一",
    "レシピ再利用で過去資産活用率を80%に向上"
  ],
  "visual": {
    "labels": ["93%\n時間削減", "100%\n品質統一", "80%\n再利用率"],
    "emphasis": "equal"
  }
}
