{
  "index": 6,
  "type": "content",
  "title": "レシピが実現するテンプレート横断",
  "message": "テンプレート非依存のレシピから、異なるテンプレートのPPTXを自動生成できる",
  "pattern": "before_after",
  "tone": "comparison",
  "body_points": [
    "従来: テンプレートごとにゼロから作り直し、座標・色を手動調整",
    "レシピ方式: 設計意図を1回記述すれば複数テンプレートに自動変換",
    "同じレシピからSX提案書・JR提案書など異なるデザインに展開可能"
  ],
  "visual": {
    "labels": ["従来\nテンプレ別に手作業", "レシピ方式\n1回の記述で複数展開"],
    "emphasis": "last"
  }
}
