{
  "index": 3,
  "type": "content",
  "title": "時間・品質・再利用の3つの壁",
  "message": "提案書作成には時間・品質・再利用の3つの根本課題があり、属人化が深刻",
  "pattern": "three_column",
  "tone": "problem",
  "body_points": [
    "作成に平均8時間、急ぎの案件では徹夜も発生",
    "デザインの属人化で品質にばらつきが生じる",
    "過去資産が埋もれ、毎回ゼロからの作成を強いられる"
  ],
  "visual": {
    "labels": ["時間の壁\n平均8時間", "品質の壁\n属人化", "再利用の壁\nゼロから作成"],
    "emphasis": "equal"
  }
}
